{
  "$schema": "https://json-schema.org/draft/2020-12/schema",
  "$id": "sws-adapter-v1",
  "title": "SWS Module Adapter Schema",
  "type": "object",
  "additionalProperties": false,
  "required": [
    "id",
    "display_name",
    "description",
    "state_class",
    "root"
  ],
  "properties": {
    "id": {
      "type": "string",
      "pattern": "^[a-z][a-z0-9_-]{0,31}$"
    },
    "display_name": {
      "type": "string",
      "minLength": 1,
      "maxLength": 64
    },
    "description": {
      "type": "string",
      "minLength": 1,
      "maxLength": 256
    },
    "state_class": {
      "type": "string",
      "enum": [
        "runnable",
        "not_started"
      ]
    },
    "root": {
      "type": "string",
      "minLength": 1
    },
    "runtime_writes": {
      "type": "array",
      "items": {
        "oneOf": [
          { "type": "string" },
          {
            "type": "object",
            "properties": {
              "path": { "type": "string", "minLength": 1 },
              "kind": { "type": "string", "enum": ["dir", "file"] }
            },
            "required": ["path", "kind"],
            "additionalProperties": false
          }
        ]
      },
      "default": []
    },
    "launch": {
      "type": "object",
      "additionalProperties": false,
      "required": [
        "cwd",
        "argv"
      ],
      "properties": {
        "cwd": {
          "type": "string",
          "minLength": 1
        },
        "argv": {
          "type": "array",
          "items": {
            "type": "string",
            "maxLength": 1024
          },
          "minItems": 1,
          "maxItems": 32
        },
        "env_allowlist": {
          "type": "array",
          "items": {
            "type": "string"
          },
          "default": [
            "SYSTEMROOT",
            "PATH",
            "TEMP",
            "TMP",
            "USERPROFILE",
            "LOCALAPPDATA",
            "APPDATA"
          ]
        },
        "env_set": {
          "type": "object",
          "additionalProperties": {
            "type": "string"
          },
          "default": {}
        }
      }
    },
    "readiness": {
      "type": "object",
      "additionalProperties": false,
      "required": [
        "kind",
        "timeout_s",
        "poll_ms"
      ],
      "properties": {
        "kind": {
          "type": "string",
          "enum": [
            "http",
            "process_window",
            "receipt_file"
          ]
        },
        "url": {
          "type": "string"
        },
        "expect_status": {
          "type": "integer",
          "minimum": 100,
          "maximum": 599
        },
        "path": {
          "type": "string"
        },
        "timeout_s": {
          "type": "integer",
          "minimum": 5,
          "maximum": 120
        },
        "poll_ms": {
          "type": "integer",
          "minimum": 250,
          "maximum": 5000
        },
        "require": {
          "type": "object",
          "description": "F-130: required key/value pairs the receipt JSON must satisfy (receipt_file readiness); defaults to {\"ok\": true} when absent."
        }
      }
    },
    "identity": {
      "type": "object",
      "additionalProperties": false,
      "required": [
        "kind"
      ],
      "properties": {
        "kind": {
          "type": "string",
          "enum": [
            "http_json",
            "http_html_marker",
            "process_image"
          ]
        },
        "url": {
          "type": "string"
        },
        "required_keys": {
          "type": "array",
          "items": {
            "type": "string"
          }
        },
        "html_marker": {
          "type": "string"
        }
      }
    },
    "open": {
      "type": "object",
      "additionalProperties": false,
      "required": [
        "kind"
      ],
      "properties": {
        "kind": {
          "type": "string",
          "enum": [
            "browser",
            "focus_window",
            "none"
          ]
        },
        "url": {
          "type": "string"
        }
      }
    },
    "stop": {
      "type": "object",
      "additionalProperties": false,
      "required": [
        "kind",
        "grace_s"
      ],
      "properties": {
        "kind": {
          "type": "string",
          "enum": [
            "job_object"
          ]
        },
        "grace_s": {
          "type": "integer",
          "minimum": 1,
          "maximum": 30
        }
      }
    },
    "startup_test": {
      "type": "object",
      "additionalProperties": false,
      "properties": {
        "env_set": {
          "type": "object",
          "additionalProperties": {
            "type": "string"
          },
          "default": {}
        },
        "readiness": {
          "type": "object",
          "additionalProperties": false,
          "required": [
            "kind",
            "path"
          ],
          "properties": {
            "kind": {
              "type": "string",
              "enum": [
                "receipt_file"
              ]
            },
            "path": {
              "type": "string",
              "minLength": 1
            },
            "require": {
              "type": "object"
            },
            "timeout_s": {
              "type": "integer",
              "minimum": 5,
              "maximum": 120
            },
            "poll_ms": {
              "type": "integer",
              "minimum": 250,
              "maximum": 5000
            }
          }
        }
      }
    }
  },
  "allOf": [
    {
      "if": {
        "properties": {
          "state_class": {
            "const": "runnable"
          }
        }
      },
      "then": {
        "required": [
          "launch",
          "readiness",
          "identity",
          "open",
          "stop"
        ]
      }
    }
  ]
}
