{
  "id": "distillery",
  "display_name": "Sovereign Distillery",
  "description": "Distillery runtime console — health only, no compute on open",
  "state_class": "runnable",
  "root": "D:\\producttion software 2\\release-worktree\\modules\\distillery",
  "runtime_writes": [
    "${state_root}/logs"
  ],
  "launch": {
    "cwd": "${root}",
    "argv": [
      "C:\\Users\\Sslaw\\AppData\\Local\\Programs\\Python\\Python312\\python.exe",
      "D:\\producttion software 2\\release-worktree\\modules\\distillery\\serve.py"
    ],
    "env_allowlist": [
      "SYSTEMROOT",
      "PATH",
      "TEMP",
      "TMP",
      "USERPROFILE"
    ],
    "env_set": {
      "PYTHONDONTWRITEBYTECODE": "1"
    }
  },
  "readiness": {
    "kind": "http",
    "url": "http://127.0.0.1:5184/health",
    "expect_status": 200,
    "timeout_s": 20,
    "poll_ms": 250
  },
  "identity": {
    "kind": "http_json",
    "url": "http://127.0.0.1:5184/health",
    "required_keys": [
      "ok",
      "status"
    ]
  },
  "open": {
    "kind": "browser",
    "url": "http://127.0.0.1:5184/console"
  },
  "stop": {
    "kind": "job_object",
    "grace_s": 5
  }
}
